"Story","Title","Result","Date","Stability","Duration (s)"
"Completing todos","Mark a task as completed","SUCCESS","2023-07-11T06:25:47.577096877Z[Etc/UTC]","0.0","13.61"
"Completing todos","List of completed items should be empty if nothing has been completed","SUCCESS","2023-07-11T06:26:01.413535083Z[Etc/UTC]","0.0","3.09"
"Deleting todos","Delete an active item","SUCCESS","2023-07-11T06:26:04.617945273Z[Etc/UTC]","0.0","1.02"
"Deleting todos","Delete all the items","SUCCESS","2023-07-11T06:26:05.732273306Z[Etc/UTC]","0.0","3.11"
"Filtering todos","View only the completed items","SUCCESS","2023-07-11T06:26:08.964448581Z[Etc/UTC]","0.0","1.21"
"Filtering todos","Viewing the items by status","SUCCESS","2023-07-11T06:26:10.252884069Z[Etc/UTC]","0.0","3.12"
