"Story","Title","Result","Date","Stability","Duration (s)"
"Completing todos","Mark a task as completed","SUCCESS","2023-08-01T05:38:55.99613915Z[Etc/UTC]","0.0","5.99"
"Completing todos","List of completed items should be empty if nothing has been completed","SUCCESS","2023-08-01T05:39:02.240986294Z[Etc/UTC]","0.0","3.87"
"Deleting todos","Delete an active item","SUCCESS","2023-08-01T05:39:06.25338694Z[Etc/UTC]","0.0","1.36"
"Deleting todos","Delete all the items","SUCCESS","2023-08-01T05:39:07.727706578Z[Etc/UTC]","0.0","3.36"
"Filtering todos","View only the completed items","SUCCESS","2023-08-01T05:39:11.220291292Z[Etc/UTC]","0.0","1.57"
"Filtering todos","Viewing the items by status","SUCCESS","2023-08-01T05:39:12.915724243Z[Etc/UTC]","0.0","4.12"
"Add new todos","Adding an item to a list with other items in Cucumber","SUCCESS","2023-08-01T05:39:18.140769309Z[Etc/UTC]","0.0","1.22"
"Add new todos","Adding items to several peoples lists in Cucumber","SUCCESS","2023-08-01T05:39:19.478483519Z[Etc/UTC]","0.0","2.38"
