"Story","Title","Result","Date","Stability","Duration (s)"
"Completing todos","Mark a task as completed","SUCCESS","2023-07-11T05:54:04.166365114Z[Etc/UTC]","0.0","5.93"
"Completing todos","List of completed items should be empty if nothing has been completed","SUCCESS","2023-07-11T05:54:10.287511318Z[Etc/UTC]","0.0","3.24"
"Deleting todos","Delete an active item","SUCCESS","2023-07-11T05:54:13.649695338Z[Etc/UTC]","0.0","1.1"
"Deleting todos","Delete all the items","SUCCESS","2023-07-11T05:54:14.876559226Z[Etc/UTC]","0.0","3.18"
"Filtering todos","View only the completed items","SUCCESS","2023-07-11T05:54:18.174175296Z[Etc/UTC]","0.0","1.42"
"Filtering todos","Viewing the items by status","SUCCESS","2023-07-11T05:54:19.675743053Z[Etc/UTC]","0.0","3.4"
"Add new todos","Adding an item to a list with other items in Cucumber","SUCCESS","2023-07-11T05:54:24.171899007Z[Etc/UTC]","0.0","1.16"
"Add new todos","Adding items to several peoples lists in Cucumber","SUCCESS","2023-07-11T05:54:25.447754915Z[Etc/UTC]","0.0","2.21"
