"Story","Title","Result","Date","Stability","Duration (s)"
"CompleteATodo","Should be able to complete a todo using imperative code","SUCCESS","2023-08-24T18:43:17.218737275Z[Etc/UTC]","0.0","0.8"
"CompleteATodo","Should be able to complete a todo using a bdd style","SUCCESS","2023-08-24T18:43:18.128365223Z[Etc/UTC]","0.0","0.49"
"CompleteATodo","Should be able to toggle the status of all todos","SUCCESS","2023-08-24T18:43:19.796260493Z[Etc/UTC]","0.0","0.5"
"CompleteATodo","Should be able to complete a todo","SUCCESS","2023-08-24T18:43:21.57049348Z[Etc/UTC]","0.0","0.55"
"CompleteATodo","Should be able to complete a todo using page objects","SUCCESS","2023-08-24T18:43:23.260835117Z[Etc/UTC]","0.0","0.71"
"CompleteATodo","Should see the number of todos decrease when an item is completed","SUCCESS","2023-08-24T18:43:24.055673586Z[Etc/UTC]","0.0","0.45"
