"Story","Title","Result","Date","Stability","Duration (s)"
"Deleting todos","Should be able to delete todos","SUCCESS","2022-02-13T09:50:14.185872701Z[Etc/UTC]","0.0","1.2"
"Deleting todos","Should see deleting a todo decreases the remaining items count","SUCCESS","2022-02-13T09:50:15.50032526Z[Etc/UTC]","0.0","1.26"
"Deleting todos","Delete an active item","SUCCESS","2022-02-13T09:48:55.618697095Z[Etc/UTC]","0.0","2.15"
"Deleting todos","Delete all the items","SUCCESS","2022-02-13T09:48:57.88866828Z[Etc/UTC]","0.0","3.54"
"Deleting todos","Should be able to delete todos with page objects","SUCCESS","2022-02-13T09:49:42.624624558Z[Etc/UTC]","0.0","1.2"
"Deleting todos","Should see deleting a todo decreases the remaining items count with page objects","SUCCESS","2022-02-13T09:49:43.936300125Z[Etc/UTC]","0.0","1.17"
