"Story","Title","Result","Date","Stability","Duration (s)"
"Filtering todos","Should be able to view only incomplete todos","SUCCESS","2022-02-13T09:38:15.705470653Z[Etc/UTC]","0.0","1.32"
"Filtering todos","Should be able to view only completed todos","SUCCESS","2022-02-13T09:38:17.129004616Z[Etc/UTC]","0.0","1.34"
"Filtering todos","Should be able to view both complete and incomplete todos","SUCCESS","2022-02-13T09:38:18.569010905Z[Etc/UTC]","0.0","1.43"
"Clear completed todos","Should be able to clear completed todos","SUCCESS","2022-02-13T09:38:25.859236451Z[Etc/UTC]","0.0","1.22"
"Complete a todo","Should be able to complete a todo with page objects","SUCCESS","2022-02-13T09:37:46.21956662Z[Etc/UTC]","0.0","1.11"
"Add new todos","Test to resolve issue #616172","SUCCESS","2022-02-13T09:37:31.184345325Z[Etc/UTC]","0.0","1.71"
"Add new todos","Should be able to add additional todo items with page objects","SUCCESS","2022-02-13T09:37:33.015410474Z[Etc/UTC]","0.0","1.23"
