"Story","Title","Result","Date","Stability","Duration (s)"
"Filtering todos","Should be able to view only incomplete todos","SUCCESS","2022-02-13T09:35:57.693967736Z[Etc/UTC]","0.0","1.6"
"Filtering todos","Should be able to view only completed todos","SUCCESS","2022-02-13T09:35:59.409290017Z[Etc/UTC]","0.0","1.72"
"Filtering todos","Should be able to view both complete and incomplete todos","SUCCESS","2022-02-13T09:36:01.240009984Z[Etc/UTC]","0.0","1.79"
"Clear completed todos","Should not be able to clear completed todos if none are complete","SUCCESS","2022-02-13T09:36:09.018818101Z[Etc/UTC]","0.0","1.14"
"Clear completed todos","Should be able to clear completed todos","SUCCESS","2022-02-13T09:36:10.267575684Z[Etc/UTC]","0.0","1.5"
"Complete a todo","Should be able to complete a todo with page objects","SUCCESS","2022-02-13T09:35:23.768617977Z[Etc/UTC]","0.0","1.49"
"Add new todos","Test to resolve issue #616172","SUCCESS","2022-02-13T09:35:04.98276681Z[Etc/UTC]","0.0","2.19"
"Add new todos","Should be able to add additional todo items with page objects","SUCCESS","2022-02-13T09:35:07.328232937Z[Etc/UTC]","0.0","1.5"
