"Story","Title","Result","Date","Stability","Duration (s)"
"CompleteATodo","Should be able to complete a todo with page objects","SUCCESS","2023-07-29T11:38:46.714979601Z[Etc/UTC]","0.0","0.96"
"ToggleAllTodos","Should be able to toggle status of all todos with page objects","SUCCESS","2023-07-29T11:38:47.801572108Z[Etc/UTC]","0.0","0.92"
"ToggleAllTodos","Should see how many items todo when all are toggled to incomplete with page objects","SUCCESS","2023-07-29T11:38:48.828497641Z[Etc/UTC]","0.0","0.89"
"ToggleAllTodos","Should see that there are zero items todo when all are toggled complete with page objects","SUCCESS","2023-07-29T11:38:49.818968865Z[Etc/UTC]","0.0","0.86"
"ToggleAllTodos","Should be able to quickly complete all todos with page objects","SUCCESS","2023-07-29T11:38:50.788520684Z[Etc/UTC]","0.0","0.92"
"ClearCompletedTodos","Should not be able to clear completed todos if none are complete with page objects","SUCCESS","2023-07-29T11:38:58.45213514Z[Etc/UTC]","0.0","0.84"
"DeletingTodos","Should be able to delete todos with page objects","SUCCESS","2023-07-29T11:38:55.349844117Z[Etc/UTC]","0.0","0.91"
"DeletingTodos","Should see deleting a todo decreases the remaining items count with page objects","SUCCESS","2023-07-29T11:38:56.361419708Z[Etc/UTC]","0.0","0.85"
"AddNewTodos","Should be able to add additional todo items with page objects","SUCCESS","2023-07-29T11:38:39.341651754Z[Etc/UTC]","0.0","0.93"
