"Story","Title","Result","Date","Stability","Duration (s)"
"Add new todos","Test to resolve issue #616172","SUCCESS","2022-02-13T09:35:04.98276681Z[Etc/UTC]","0.0","2.19"
"Add new todos","Should be able to add additional todo items with page objects","SUCCESS","2022-02-13T09:35:07.328232937Z[Etc/UTC]","0.0","1.5"
"Add new todos","Should be able to add the first todo item","SUCCESS","2022-02-13T09:35:36.42291568Z[Etc/UTC]","0.0","1.01"
"Add new todos","Should be able to add additional todo items","SUCCESS","2022-02-13T09:35:37.533634389Z[Etc/UTC]","0.0","1.45"
"Add new todos","Adding an item to an empty list in Cucumber","SUCCESS","2022-02-13T09:34:55.862372215Z[Etc/UTC]","0.0","0.97"
"Add new todos","Adding an item to a list with other items in Cucumber","SUCCESS","2022-02-13T09:34:56.952490478Z[Etc/UTC]","0.0","1.45"
"Add new todos","Adding items to several peoples lists in Cucumber","SUCCESS","2022-02-13T09:34:58.516766883Z[Etc/UTC]","0.0","2.91"
