"Story","Title","Result","Date","Stability","Duration (s)"
"Completing todos","Mark a task as completed in Cucumber","SUCCESS","2018-10-15T18:34:58.481+05:30[Asia/Kolkata]","0.0","14.47"
"Completing todos","List of completed items should be empty if nothing has been completed","SUCCESS","2018-10-15T18:35:13.006+05:30[Asia/Kolkata]","0.0","16.91"
"Filtering todos","View **only completed items** #123 in Cucumber","SUCCESS","2018-10-15T18:35:29.971+05:30[Asia/Kolkata]","0.0","15.26"
"Filtering todos","Viewing items **by status** in Cucumber","SUCCESS","2018-10-15T18:35:45.285+05:30[Asia/Kolkata]","0.0","31.7"
"Add new todos","Adding an item to an empty list in Cucumber","SUCCESS","2018-10-15T18:36:17.257+05:30[Asia/Kolkata]","0.0","11.06"
"Add new todos","Adding an item to a list with other items in Cucumber","SUCCESS","2018-10-15T18:36:28.367+05:30[Asia/Kolkata]","0.0","13.7"
"Add new todos","Adding items to several peoples lists in Cucumber","SUCCESS","2018-10-15T18:36:42.118+05:30[Asia/Kolkata]","0.0","28.49"
